<?xml version="1.0" encoding="utf-8"?>
<!DOCTYPE knimeNode PUBLIC "-//UNIKN//DTD KNIME Node 1.0//EN" "http://www.knime.org/Node.dtd">
<knimeNode type="Manipulator" icon="moving_avg.png">
    <name>Moving Average</name>
    <shortDescription>Adds a column with moving average values.</shortDescription>
    <fullDescription>
        <intro>
            This node calculates the moving average of a column.
            The moving average values are displayed in a new column appended 
            at the end of the table.
        </intro>
        <option name="Columns containing Double Values">
        Select the input column containing double values on which to
        perform the moving average.</option>
        <option name="Type of Moving Average"> Moving Average can be simple 
         or exponential (used in financial analysis).
        </option>
        <option name="Window Length"> The number of samples to include in 
        the moving average window. It has to be an odd number. 
        Minimum value: 3 samples. Maximum Value: Time Series length.
        </option>
    </fullDescription>
    <ports>
        <dataIn index="0" name="Input column">
        Table containing time series.</dataIn>
        <dataOut index="0" name="Wrapped output">
        Table with appended column holding moving average values.</dataOut>
    </ports>
</knimeNode>