<?xml version="1.0" encoding="utf-8"?>
<!DOCTYPE knimeNode PUBLIC "-//UNIKN//DTD KNIME Node 2.0//EN" "http://www.knime.org/Node.dtd">
<knimeNode type="Manipulator" icon="dateshift.png">
    <name>Date/Time Shift </name>
    
    <shortDescription>
        Adds a value as defined in a numerical column in a defined granularity to an existing date.
    </shortDescription>
    
    <fullDescription>
        <intro> This node adds the value of a numerical column to an existing date. This value can represent different
        aspects of the date, as defined by its aggregation level 
        (year, quarter, month, week, day, hour, minute).
        
        There are different possibilities for selecting a date. The first possibility is the execution time, which will 
        produce a different result in each run. The second one, is a date and time column. It is also possible to enter 
        a fixed date in the dialog or to use the 1.1.1970, which is the default zero in Unix applications.
        </intro>
        
        <option name="Select value column">Select the column containing the value to apply.</option>
        <option name="Select a date column">Select a column containing a date</option>
        <option name="Fixed time">Select a fixed time.</option>   
        <option name="Select granularity of value">The granularity of the numerical column 
        	(in years, quarters, months, weeks, days, hours, minutes)</option>
        <option name="Appended column name">Name of the newly appended column containing the calculate date/time. </option>  
        <option name="Fixed time">The fixed time for the corresponding option. </option>  
        <option name="Use date">Check for using the date in the output date column. </option>      
        <option name="Use time">Check for using the time in the output date column. </option>      
        <option name="Use miliseconds">Check for using the miliseconds in the output date column. </option>                              
    </fullDescription>
    
    <ports>
        <inPort index="0" name="Table with date information">In data with at least one numerical column</inPort>
        <outPort index="0" name="Date">Out data with the calculated date appended</outPort>
    </ports>    
</knimeNode>
