<?xml version="1.0" encoding="utf-8"?>
<!DOCTYPE knimeNode PUBLIC "-//UNIKN//DTD KNIME Node 1.0//EN" "http://www.knime.org/Node.dtd">
<knimeNode  type="Source">
    <name>Time Generator</name>
    
    <shortDescription>
        Generates time values
    </shortDescription>
    
    <fullDescription>
        <intro>Generates time values with a certain number of equidistant 
        entries and within a configurable time period.</intro>
        
        
        <option name="Number of rows">How many rows should be generated</option>  
        <option name="Choose granularity level">Starting point of the time period</option>        
        <option name="Appended column name">End point of the time series</option>        
    </fullDescription>
    
    <ports>
        <dataOut index="0" name="Generated date">One column with the generated time</dataOut>
    </ports>    
</knimeNode>
