<?xml version="1.0" encoding="utf-8"?>
<!DOCTYPE knimeNode PUBLIC "-//UNIKN//DTD KNIME Node 2.0//EN" "http://www.knime.org/Node.dtd">
<knimeNode type="Manipulator" icon="moving_avg.png">
    <name>Moving Average</name>
    <shortDescription>Adds a column with moving average values.</shortDescription>
    <fullDescription>
        <intro>
            This node calculates the moving average of a column.
            The moving average values are displayed in a new column appended 
            at the end of the table.
        </intro>
        <option name="Columns containing Double Values">
        Select the input column containing double values on which to
        perform the moving average.</option>
    </fullDescription>
    <ports>
        <dataIn index="0" name="Input column">
        Table containing time series.</dataIn>
        <dataOut index="0" name="Wrapped output">
        Table with appended column holding moving average values.</dataOut>
    </ports>
</knimeNode>