<?xml version="1.0" encoding="utf-8"?>
<!DOCTYPE knimeNode PUBLIC "-//UNIKN//DTD KNIME Node 2.0//EN" "http://www.knime.org/Node.dtd">
<knimeNode type="Manipulator" icon="time_difference.png">
    <name>Time Difference</name>
    
    <shortDescription>
        Appends the difference between two dates.
    </shortDescription>
    
    <fullDescription>
        <intro>Appends the difference between two dates with the selected aggregation level 
        (year, quarter, month, week, day, hour, minute) and a selected precision for rounding.
        </intro>
        
        <option name="Select first date column">Select the column containing the start date</option>
        <option name="Select second date column">Select the column containing the end date</option>
        <option name="Select granularity of time difference">The granularity of the difference 
        	(in years, quarters, months, weeks, days, hours, minutes)</option>
        <option name="Rounding mode">How many fraction digits</option>
        <option name="Appended column name">Name of the newly appended column containing the time difference</option>                                
    </fullDescription>
    
    <ports>
        <inPort index="0" name="2 date columns">In data with at least two date columns</inPort>
        <outPort index="0" name="Difference">Out data with the time difference appended</outPort>
    </ports>    
</knimeNode>
