<?xml version="1.0" encoding="utf-8"?>
<!DOCTYPE knimeNode PUBLIC "-//UNIKN//DTD KNIME Node 1.0//EN" "http://www.knime.org/Node.dtd">
<knimeNode  type="Manipulator">
    <name>Time Aggregator</name>
    
    <shortDescription>
        Aggregates the time to a higher aggregation level (e.g. month to quarter).
    </shortDescription>
    
    <fullDescription>
        <intro>Takes the time values from a column, aggregates it to a higher 
        granularity level (e.g. from month to quarter, etc.) and appends the 
        result as a string column.</intro>
        
        
        <option name="Select time column">Select the column containing the time that should be aggregated</option>	
        <option name="Choose granularity level">Choose aggregation level (year, quarter, month, week, day)</option>        
        <option name="Appended column name">The name of the new column</option>        
    </fullDescription>
    
    <ports>
        <dataIn index="0" name="Date column">In data with at least one date column</dataIn>
        <dataOut index="0" name="Aggregated date">In data with the aggregated time column appended</dataOut>
    </ports>    
</knimeNode>
