<?xml version="1.0" encoding="utf-8"?>
<!DOCTYPE knimeNode PUBLIC "-//UNIKN//DTD KNIME Node 2.0//EN" "http://www.knime.org/Node.dtd">
<knimeNode type="Manipulator" icon="time_patterns.png">
    <name>Patterns between events</name>
    <shortDescription>Extracts patterns between events 
    (events represented as strings) in an apposite column.
    </shortDescription>
    <fullDescription>
        <intro>
            Extracts patterns from the input table located between 
            string "xxxx", where xxxx is the name of the event 
            (for example "split").
        </intro>
        <option name="Columns containing event strings">
        Select the input column containing the name of the event where you
        to split the original time series.</option>
        <option name="String Event">
        Name of the events where to split the original time series.</option>
        <option name="Column to generate output from">
        Name of the column from which patterns will be extracted.</option>
    </fullDescription>
    <ports>
        <dataIn index="0" name="Input column">
        Table containing string event column.</dataIn>
        <dataOut index="0" name="Wrapped output">
        Table containing new patterns.</dataOut>
    </ports>
</knimeNode>