<?xml version="1.0" encoding="utf-8"?>
<!DOCTYPE knimeNode PUBLIC "-//UNIKN//DTD KNIME Node 2.0//EN" "http://www.knime.org/Node.dtd">
<knimeNode type="Manipulator" icon="time_events.png">
    <name>Time Series between events</name>
    <shortDescription>Extracts time series between events 
    (represented as strings) in an apposite column.
    </shortDescription>
    <fullDescription>
        <intro>
            Extracts time series from the input table located between 
            string "xxxx", where xxxx is the name of the event 
            (for example "split").
        </intro>
        <option name="Columns containing event strings">
        Select the input column containing the name of the event where you
        to split the original time series.</option>
        <option name="String Event">
        Name of the events where to split the original time series.</option>
        <option name="Date for output table">
        Output table will be the one conatining data from this date</option>
        <option name="Date Format">
        Date format for previous parameter</option>
        <option name="timestamp column name">
        Name of colun containing timestamp data</option>
    </fullDescription>
    <ports>
        <dataIn index="0" name="Input column">
        Table containing string event column.</dataIn>
        <dataOut index="0" name="Wrapped output">
        Table containing the time series between event i 
        and event i+1 and date as specified in dialog panel.</dataOut>
    </ports>
</knimeNode>