<?xml version="1.0" encoding="utf-8"?>
<!DOCTYPE knimeNode PUBLIC "-//UNIKN//DTD KNIME Node 2.0//EN" "http://www.knime.org/Node.dtd">
<knimeNode type="Manipulator" icon="time_field_extractor.png">
    <name>Time Field Extractor</name>
    <shortDescription>Extracts time fields such as year, month, hour, minute
    from a timestamp and appends the value as integer columns.
    </shortDescription>
    <fullDescription>
        <intro>
            Extracts the selected time fields from a timestamp column and
            appends the values as integer columns. Valid fields are year, month,
            day, hour, minute, second and millisecond. If the values are not 
            set in the timestamp a missing value is added in the 
            result table.    
        </intro>
        <option name="Column containing timestamps">
        Select the input column containing date/time stamps.</option>
        <option name="Year">Check if the year should be extracted and appended 
        as an integer column. The name for this column can be specified.
        </option>
        <option name="Quarter">Check if the quarter as a number in [1,4] should 
        be extracted and appended as an integer column. 
        The name for this column can be specified.
        </option>        
        <option name="Month">Check if the month should be extracted and appended 
        as an integer column. The name for this column can be specified.
        </option>
        <option name="Month as">Select whether the (English) name of the month
        should be appended to the output table or the number of the month in 
        [1, 12].</option>
        <option name="Day">Check if the day of month should be extracted and 
        appended as an integer column. 
        The name for this column can be specified.
        </option>
        <option name="Hour">Check if the hour of day should be extracted and 
        appended as an integer column. 
        The name for this column can be specified.
        </option>
        <option name="Minute">Check if the minute should be extracted and appended 
        as an integer column. The name for this column can be specified.
        </option>
        <option name="Second">Check if the second should be extracted and appended 
        as an integer column. The name for this column can be specified.
        </option>           
        <option name="Millisecond">Check if the millisecond should be extracted 
        and appended as an integer column. 
        The name for this column can be specified.
        </option>             
    </fullDescription>
    <ports>
        <inPort index="0" name="Input column">
        Table containing timestamp cells.</inPort>
        <outPort index="0" name="Extracted time fields">
        Input table with extracted time fields appended</outPort>
    </ports>
</knimeNode>