<?xml version="1.0" encoding="utf-8"?>
<!DOCTYPE knimeNode PUBLIC "-//UNIKN//DTD KNIME Node 2.0//EN" "http://www.knime.org/Node.dtd">
<knimeNode type="Manipulator" icon="time_per_day.png">
    <name>One Sample per Day</name>
    <shortDescription>Extracts one row per each day from input table.
    </shortDescription>
    <fullDescription>
        <intro>
            Extracts one row of values per day at a fixed time of day.
        </intro>
        <option name="Columns containing Timestamp">
        Select the input column containing timestamp cells.</option>
        <option name="At: Timestamp">
        Timestamp to use to extract one value per day.</option>
    </fullDescription>
    <ports>
        <dataIn index="0" name="Input column">
        Table containing timestamp cells.</dataIn>
        <dataOut index="0" name="Wrapped output">
        Sub-Table containing only data extracted at 
        "At: Timestamp" each day.</dataOut>
    </ports>
</knimeNode>