<?xml version="1.0" encoding="utf-8"?>
<!DOCTYPE knimeNode PUBLIC "-//UNIKN//DTD KNIME Node 2.0//EN" "http://www.knime.org/Node.dtd">
<knimeNode icon="feature_elimination_loop_end.png" type="LoopEnd">
	<name>Feature Selection Loop End</name>

	<shortDescription>End node for a feature selection loop</shortDescription>

	<fullDescription>
		<intro>
			This is the end of a feature selection loop which selects
			features
			according to a feature selection strategy.
		</intro>

		<option name="Score variable">The flow variable that contains the score for the
			model
		</option>
		<option name="Minimize">Check if the score should be minimized (for
			example if you use the classification error as score)
		</option>
	</fullDescription>

	<ports>
		<inPort index="0"
			name="FlowVariable connection containing the score variable">FlowVariable connection that contains the variable you want to
			use as score.
		</inPort>
		<outPort index="0" name="Feature Selection Model">A model that represents the different
			column selections with the associated scores.
		</outPort>
	</ports>
</knimeNode>
